{
  "schemaVersion": 2,
  "rendererVersion": "android-alpha-renderer-1",
  "locale": "fr",
  "song": {
    "source": "unknown",
    "title": "La ville en silence",
    "artist": "Ligne de fuite",
    "album": "Après minuit",
    "explicit": false,
    "coverAssetId": null
  },
  "content": {
    "mode": "lyrics",
    "lyrics": "La ville retient son souffle\nSous les fenêtres encore allumées\nNos pas dessinent une route\nQue le matin saura garder\nEt dans le bruit des heures\nJe reconnais ta voix",
    "translationEnabled": false,
    "translation": "",
    "instrumentalText": "Instrumental",
    "lyricDocument": {
      "schemaVersion": 2,
      "id": "document-1",
      "revision": 0,
      "blocks": [
        {
          "id": "block-2",
          "formatting": {
            "sourcePresent": true,
            "translationPresent": false,
            "sourceSeparatorAfter": "",
            "translationSeparatorAfter": ""
          },
          "units": [
            {
              "id": "unit-3",
              "source": [
                "La ville retient son souffle"
              ]
            },
            {
              "id": "unit-4",
              "source": [
                "Sous les fenêtres encore allumées"
              ]
            },
            {
              "id": "unit-5",
              "source": [
                "Nos pas dessinent une route"
              ]
            },
            {
              "id": "unit-6",
              "source": [
                "Que le matin saura garder"
              ]
            },
            {
              "id": "unit-7",
              "source": [
                "Et dans le bruit des heures"
              ]
            },
            {
              "id": "unit-8",
              "source": [
                "Je reconnais ta voix"
              ]
            }
          ]
        }
      ],
      "formatting": {
        "sourcePrefix": "",
        "translationPrefix": ""
      }
    }
  },
  "canvas": {
    "layoutMode": "portrait",
    "ratio": "custom",
    "width": 1040,
    "height": 1080,
    "autoHeight": true,
    "pixelRatio": 1
  },
  "typography": {
    "fontScheme": "sans-heavy",
    "fontFamily": "Source Han Sans SC",
    "lyricSize": 52,
    "lineHeight": 1.42,
    "alignment": "right",
    "translationScale": 0.72,
    "twoLineTitle": true,
    "textColorMode": "custom",
    "textColorPreset": "white",
    "customTextColor": "#F7EEDC"
  },
  "visual": {
    "backgroundMode": "palette",
    "palette": {
      "dominant": "#283545",
      "secondary": "#46596B",
      "accent": "#AF765F"
    },
    "gridEnabled": true,
    "gridDensity": "dense",
    "gridOpacity": 0.08
  },
  "visibility": {
    "showCover": false,
    "showSongInfo": true,
    "showAlbum": true,
    "showPlatformBadge": false,
    "showSharedBy": true,
    "showGeneratedWatermark": false
  },
  "branding": {
    "sharedByName": "Partagé par Qrzzzz",
    "platform": "unknown"
  },
  "media": {
    "coverCropScale": 1
  }
}
